{
  "schema_version": 1,
  "spec_id": "harbor-covenant-set",
  "revision": 1,
  "locks": [
    "/factions/0/identity",
    "/assets/1/carrier/shape"
  ],
  "factions": [
    {
      "faction_id": "harbor-covenant",
      "name": "Harbor Covenant",
      "identity": {
        "motif": "One upright split crescent enclosing a three-point beacon",
        "silhouette": "Broad open crescent with three short beacon rays inside",
        "arrangement": "Beacon centered inside the crescent opening, opening points upward",
        "palette": [
          "Ocean teal field",
          "Bone-white crescent",
          "Copper beacon"
        ],
        "distinctive_marks": [
          "One small square gap at the bottom of the crescent"
        ],
        "constraints": [
          "Keep three beacon rays and the single square gap",
          "Do not mirror or rotate the base emblem"
        ]
      },
      "reference_ids": [],
      "emblem_reference_id": null,
      "consistency_anchor_asset_id": "covenant-emblem",
      "gm_only": false,
      "gm_notes": ""
    }
  ],
  "assets": [
    {
      "asset_id": "covenant-emblem",
      "faction_id": "harbor-covenant",
      "title": "Harbor Covenant master emblem",
      "intended_use": "Canonical visual anchor for the requested seal and flag set",
      "kind": "emblem",
      "intent": "generate",
      "carrier": {
        "material": "Flat painted insignia",
        "shape": "Free-standing crescent device",
        "viewpoint": "front-facing",
        "orientation": "upright",
        "composition": "centered, complete edges visible",
        "reading_size_px": 64
      },
      "background": {
        "mode": "transparent",
        "description": "Transparent outside the emblem"
      },
      "output": {
        "width_px": 1024,
        "height_px": 1024,
        "aspect_ratio": [
          1,
          1
        ]
      },
      "lettering": {
        "wording": "",
        "mode": "none",
        "placement": ""
      },
      "art_direction": {
        "medium": "Fantasy heraldic illustration",
        "rendering": "Bold contour, minimal ornament",
        "lighting": "Even"
      },
      "reference_ids": [],
      "edit_target_ref": null,
      "constraints": [],
      "gm_only": false,
      "gm_notes": ""
    },
    {
      "asset_id": "covenant-seal",
      "faction_id": "harbor-covenant",
      "title": "Harbor Covenant wax seal",
      "intended_use": "Standalone player-facing seal reference for later handout reuse",
      "kind": "seal",
      "intent": "generate",
      "carrier": {
        "material": "Dark teal sealing wax, intentionally monochrome; preserve the motif through raised relief",
        "shape": "Round wax disk with irregular outer lip",
        "viewpoint": "front-facing",
        "orientation": "upright",
        "composition": "Device upright in raised relief, complete wax rim in frame",
        "reading_size_px": 96
      },
      "background": {
        "mode": "transparent",
        "description": "Transparent outside the wax rim"
      },
      "output": {
        "width_px": 1024,
        "height_px": 1024,
        "aspect_ratio": [
          1,
          1
        ]
      },
      "lettering": {
        "wording": "",
        "mode": "none",
        "placement": ""
      },
      "art_direction": {
        "medium": "Illustrated wax seal",
        "rendering": "Tactile wax with restrained texture",
        "lighting": "Soft upper-left light revealing raised relief"
      },
      "reference_ids": [],
      "edit_target_ref": null,
      "constraints": [],
      "gm_only": false,
      "gm_notes": ""
    },
    {
      "asset_id": "covenant-flag",
      "faction_id": "harbor-covenant",
      "title": "Harbor Covenant flag",
      "intended_use": "Faction reference illustration, not a placed map prop",
      "kind": "flag",
      "intent": "generate",
      "carrier": {
        "material": "Ocean teal woven wool with bone-white and copper applique",
        "shape": "Rectangular flag with a straight trailing edge",
        "viewpoint": "front-facing",
        "orientation": "upright",
        "composition": "Entire flag visible, gentle folds, emblem on primary face unobscured",
        "reading_size_px": 128
      },
      "background": {
        "mode": "solid",
        "description": "Warm neutral field that separates fabric edges"
      },
      "output": {
        "width_px": 1536,
        "height_px": 1024,
        "aspect_ratio": [
          3,
          2
        ]
      },
      "lettering": {
        "wording": "Keep the Light",
        "mode": "compose_later",
        "placement": "Reserved blank horizontal band beneath emblem; centered exact motto"
      },
      "art_direction": {
        "medium": "Fantasy textile illustration",
        "rendering": "Clear device over broad cloth folds",
        "lighting": "Soft side light"
      },
      "reference_ids": [],
      "edit_target_ref": null,
      "constraints": [],
      "gm_only": false,
      "gm_notes": ""
    }
  ],
  "references": [],
  "gm_notes": ""
}
